{"format":"proof-gym-private-holdout-pack-v1","native_competence_claim":false,"pack_id":"reference-holdout-v1","runtime":{"path":"runtime/reference-runtime.json","runtime_id":"reference-v1","sha256":"6dc879f10e5d1b092185675286576ca8371dd4af39446c184476e8c1576a2346"},"tasks":[{"path":"tasks/hg_f8.json","sha256":"f5dc18e154f4365eecf94b2fc09453345d75fb7fcd28197723c426385cf964fd","snapshot":{"path":"snapshots/env-d13f6e.json","sha256":"79fb6a802061962f4dd6a25e993a37c0ab6e8582dbe2bed24a8572e65706fa3c","snapshot_id":"env-d13f6e"},"task_id":"hg_f8"}]}